post_id,text,disease,label
85762834,"Some called it red flower, it is to as herb for babies rashes,you can cook it with the outer part of onions, the baby can drink it and also use for bathing. It also work for typhoid or malaria, when you cook with pap water,lemon grass and other.",malaria,0
104667082,"Stroke at these early ages (20,21). I also just learned that babies can have cancer.This life is complex",stroke,1
12379897,I know a man who has been married for 37yrs and discovered last yr that his wife had another child before marriage.The boy he usually sees with the wifes mother who should be like 43yrs old now was actually his wifes first childThe man died earlier this year from stroke,stroke,0
55072157,Abeg carry her to the hospital eh! I don't know why you even went to the pharmacy sef. There are some malaria drugs pregnant women don't take.,malaria,1
16351145,"Pls doctor, reply my post. Am now 13 month pregnant now . Feeling feverish n very weak. I was treated for malaria but am still feeling sharp pains in my abdomen. And my bosom still pains me slightly. Pls what could be the course of this? Thanks",malaria,0
64601442,You almost got a heart attack yesterday when President Buhari stole the show at the African Union yesterday didn't you?,heart attack,2
25369483,People that cannot care for malaria fever in their household will come and rant rubbish. Goodluck is going to be blamed for miscarriages too,malaria,1
16340653,Ac highly resistant to malaria but should not be exposed to mosquitoes,malaria,1
92549059,Na so I mumushly follow one yeye girl for NYSC camp go check HIV status. Those few minutes of waiting for the result is the longest minutes of my life. I was sweating profusely. thank God I didn't die of heart attack that day.,heart attack,1
37647781,"Hello everyone,iv been following this trend,and am happy to be a part of it.I am 19weeks preggy,and av not treated malaria.what do you think and what type of malaria drug do u think I shld take cos av not reg.for ANT.thanks a lot.",malaria,0
12452558,"My mom got stroke,,, now her left hand and left foot paralyzed,, pls give some advise,, thanks before",stroke,0
16695587,"drinking agbo before going to bedhowever if you malaria, you better drink that agbo!",malaria,1
46727644,"this pictures will give some people heart attack and sleepless night, many people will not sleep this night. those are the ones that wished our president death, they know themselves, they re from the yeast coast.",heart attack,1
70106821,"He just saved himself the likely of unhealthy and untimely death. Heart disease,diabetes,,stroke,chronic tiredness,immobility and all the avoidable degenerating diseases.",stroke,1
3474819,chai Benny dat malaria blister still dey ur mouth ?,malaria,0
7662381,like a heart attack,heart attack,0
89171269,Is there any vaccine against malaria? which state is mosquito free in Nigeria?,malaria,1
56409136,"Thank you so much, ve decided to register with luth and a private hospital. u can imagine The hosipal I attended when i had malaria at Ago has only one doctor, I had to wait for almost 1 hr b4 the doctor showed up. Will surely put all this in check.",malaria,0
56351627,"He is too fat, una go complain.......He is too lean, una go complain ............We currently have a lean president, spending our yam flying to the UK for ENT appointments and malaria free blood transfusions ....Lets try an orobo, for a change ........",malaria,1
32341114,doc said malaria and weakness. so I'm gonna take drip.,malaria,0
104199899,oga Nigerian hospital no dey pass malaria n typhoid. Go and do a CT or Mri scan,malaria,1
103525339,"... Very soon Frustration , Hypertension , and Stroke go jam you over Tinubu matter",stroke,1
108496645,"Pandemic in this part of the world is not as they make it look.Banditry, corruption and Malaria has killed more people than than COVID-19",malaria,1
53078016,What of Patent drug stores?Those guys are just good in administering injections and malaria tablets.,malaria,1
96861857,"Smh, any thread that stroke you guys ego to pieces is always the legit and correct and senseible one, how y'all are blind to all the falsehood in her write up in this country and the world at large, beats me, honestly, You guys like to deceive yourself by yourself.",stroke,2
106572957,"Herbs ke?Who says you can't be treated of Malaria in pregnancy?Please madam, carry yourself to the hospital right away and discontinue any herbs at this stage.You can and will be treated of Malaria. Don't hurt urself and the poor baby.",malaria,0
79941414,See this people.. Nigeria it's self Na big malaria and headaches,malaria,2
97758160,"Bro, my Dad and Mum had it. My Dad finished Malaria drugs TWICE, it didn't subside. For 3 weeks and he was hit very bad.It was until he started taking that Ginger, Garlic mix that he started getting better. The thing is worse than Malaria.",malaria,0
46667705,"Of course you can. I treated malaria at 10weeks too but don't self-medicate. See your doc for proper treatment. Most malaria drugs can harm your baby so you have to be careful. And whatever treatment your doc prescribes, always double check becos no doc is perfect.",malaria,0
57100798,"[quote author=BrightForYou post=57100157][/quote]I'm also AA, my sis is AS n she hardly falls ill with malaria, typhoid, headaches, unlike me. I use blood tonic often. Does dis happen, I mean AS rarely falling ill while its smtyms frequent with AA... ?",malaria,1
63425230,"my able cappo I'm gud today I TankGod, I treated malaria last week I'm stronger and beta. I pray for a healthy journey to delivery for al mamas.",malaria,0
93138775,Covid19 as it is in Nigeria is NOT worth shutting down our country for. Malaria takes more lives than this!,malaria,1
103062064,"I tried this, it didn't work.Went to the hosptl earlier today, and I tested +ve to malaria.I've been given drugs, and rest was recommended.Thanks mama!",malaria,0
55716957,if u stil believe in a country called nigeria.... u might die of heart attack the chance of nigeria being together 2019 is shaking....,heart attack,1
41845580,GA causing heart attack how many days post op?Come on!!!,heart attack,1
90412622,Then treat malaria first,malaria,1
87745378,"Stop this misinformation.How is malaria more deadly?How many people have died from malaria compared with coronavirus in the last 3 months?Malaria has a cure, coronavirus does not have yet.",malaria,1
5971695,"Please Doc.Do advice I am having this all body joint pain, its could be any time of the day. at first i thought of malaria cos attimes it comes with fever and weakness. I ve treated malaria but i still experience this pain. Please adviceThanks",malaria,0
62519321,"My sis I dey here o, Na my phone dey act up plus I'm a bit down with malaria. ..How are you and John doing? Thanks for checking",malaria,0
70795369,"Malaria and Typhoid center, that was quite hilarious.",malaria,2
80911310,People were sacrificed for malaria,malaria,1
99092469,Trump may die of heart attack with this,heart attack,2
12452027,hello i am very happy to inform you all that if you know anyone that has stroke pls contact me and i shall give them direction..,stroke,1
86898569,Alright dear. Please go to hospital. Malaria if not treated isn't good for your baby. I wish you quick recovery and a successful carriage.,malaria,0
4076114,u get malaria ni?,malaria,1
17806886,"u need a strong malaria drug...haba..for goin to jail, for wat now!",malaria,2
58052476,"TBJ said some sicknesses are curse and needs deliverance. Mine is malaria every 2wks, I go hospital tire and decided to forget about the symptoms. Whenever i feel sick, i will go drink beer and go to work and treat the malaria anytime i willingly wishes. Nonesense sickness",malaria,0
104511435,God has been kind I haven't been to the hospital in years or bedridden.The last time I been sleep for hospital bed na Typhoid ati Malaria matter.,malaria,0
44789662,Association of Wailers will hear this and suddenly develop Heart attack! #IstandwithBuhariWailers can go to jail!!,heart attack,2
27199239,"I tink u shed go 4 a malaria test,cos wen he was down he refused to eat. Try other types of food too egg, fish , chicken, potatoes etc",malaria,0
86891203,"OK......now we know..... in my first pregnancy, i had typhoid and malaria and was admitted for days. I was majorly treated with drugs, no injection. It was when I was unable to sleep that I was then given injection.... I will advise you run test and be sure......",malaria,0
30106894,Dreaming . Maybe she has malaria. She better go and take malaria drugs,malaria,1
8091493,"Please go see your doctor. It could be high blood pressure, glaucoma, or a minor stroke. It could also be minor afflictions like tiredness and strain of the eye.",stroke,0
68021395,Leopantro don't you think this should hit more nerves of 'malaria specialists' like you and mrbigiman?,malaria,1
107099204,Your Dad taking viagra at this age is a big problem. It could lead to a heart attack. He has to stop!I don’t know what you’ll do but he has to stop taking viagra.,heart attack,1
93669362,"if you are a nigeria, and u have been diagnose for malaria, you are a victim forever.weather poor or rich....malaria has no cure, we only prevent it or recover from it.",malaria,1
90384673,"I'm telling you my brother! Exactly what some of us have been saying, but some people choose not to understand. Covid 19 is simply Malaria elder brother. Nothing more.",malaria,1
56724745,"This thread should either be modified or taken down by the op. it obviously shows that you have suboptimal medical information. The aforementioned drugs, when used singly increases the possibility of resistance. hence, combination therapy with the use of ACT, artesunate/fansidar is currently being advised for uncomplicated malaria.",malaria,1
97208014,I bought an ibumartem medicine against malaria.I sent the pin to the code indicated on the medicine but I haven't gotten response.Is it possible it could be fake,malaria,1
106222509,Please guys help what drugs can I use I feel internal heat and weight loss. I have treated typhoid and I did test for malaria which was negative. Sometimes I feel the heat at the back sometimes at the thigh sometimes my stomach.,malaria,0
34730764,Leave am abeg. Na malaria induced hallucination,malaria,2
28920670,"Bro, I don't want uncle Jona to waste our money again unnecessarily, February 14 is our d-day when heart attack and sudden high blood pressure will be a common thing in this present administration.vote wisely, not because of rice and Maggie.vote for change and let your change be your REVOLUTION.",heart attack,2
85891678,"but can I have malaria here? I'm outside the country at the moment. It's late now, I will go first thing tomorrow. Thanks mummy",malaria,0
38906542,NO Bite No Malaria. Use mosquito net on your bed. We deliver to your house or office. Give us a call now or visit our webpage for your choice net at mykingbiz dot dot com,malaria,1
66409026,"Pray to God but row for shore.If only our churches could build a specialist hospital for the treatment of ailments as this.What am I even saying? Our politicians and pastors are the richest in the world and Bill Gates is still coming here to subsidise drugs for TB, Malaria and Polio.",malaria,2
30063788,Dude how did you strike a stroke in that fools comment? *in buhari's voice* teash me,stroke,2
108907164,"Hmm virus here and there Any virus either covid,omicron,herpes,hiv and hepatitis,for herbal treatment dm meCheck my signature and profile for my work....contact me on anything about your HEALTH TRADOMEDICALLY...",hepatitis,1
10668871,dear doctoris it possible to have malaria immediately after treatment?if so how many days after and what can be used to prevent recurrence,malaria,1
64680557,"Bye bye betting.Believe me, the kain heart attack wey won kill me today ehAbeg I no do again",heart attack,2
90216332,"It is a scam bro, a friend of mine was forcefully quarantined because of malaria symptoms.",malaria,0
96012792,This is laughable. Covid cases in most African countries were not severe.Most of the reported cases might even be malaria . Had it hit Nigeria like it did in the US I don't think there would have been a soul left in Nigeria.,malaria,1
95067516,"Guys, na house I dey ọ. Malaria don knock me down.",malaria,0
61161398,"Why recycling same warning over and over. Once any disease breakout , the next statement will be stop eating death animals mostly monkey...This is disease will keep spreading as long a commoner in Nigeria can't get good health treatment for malaria <user> centers nationwide....Rubbish",malaria,1
30583990,"Medical laboratory scientist, a doctor consultant, a bedrock of modern medicine. An heart attack to a Nigerian physician. Medical laboratory sciences has evolved over the year. 85% of hospital data emanates from the laboratory.",heart attack,1
5831470,"Is it true that  if mosquitoes bite  ""AA""person, such person will fall sick(malaria)  but if the mosquitoes bite ""AS"" person there will be no malaria",malaria,1
27970874,"Guy , if one works hard, he can move from 2 dollars to 200 dollars a day.A businessman, a civil servant, an artisan, by hard work and stroke of luck everyone can become a millionaire.All that one needs is to be mentally alert to opportunities around him.",stroke,2
81842100,"I did tell them at the lab the symptoms I've been having and they did urinalysis, hiv and hepatitis",hepatitis,1
98371218,He maybe Hypertensive or he had a heart attack.RIP,heart attack,0
50476592,Are you having a stroke?,stroke,1
55351677,"Ok is good meanwhile , kindly return all the looted fund from our kwarapt ( corrupt ) leaders stole since 1960 till date .We are waiting because we need it to recover from economic heart attack .Thank you .",heart attack,2
97213517,Why should Nigerians be vaccinated? Malaria is our problem... not COVID-19. Why should we be taking panadol for their headache? Red flags should go up when we hear these nations are showing concern for the health of Africans period.,malaria,1
5248251,do you know that hepatitis kills and spread faster aids,hepatitis,1
53189478,The following are some disease conditions that are amenable (co-managed some times) to physiotherapy:* Facial palsy * Cerebral palsy * Erb's palsy * Injection palsy* Spondylosis * spondylolisthesis * Cerebrovascular Accident (stroke) * Spinal Cord Injury (SCI) * Osteoarthritis * Guillain-Barre Syndrome (GBS),stroke,1
27411835,"<user> i thought you were supposed to do serum pt? you can just take paracetamol at the moment then visit your hospital later so they can run a proper test on you and give you the right drug, dont self medicate on malaria drug while ttc cos most pregnancies comes with malaria",malaria,1
77219781,� tnks tink i nided dat.. D fever has gone dwn.. Been on malaria meds,malaria,0
103855347,"Lagos is always topping the league.. Guys let's not joke ooo. The virus is here to stay... It is new global disease just as malaria is synonymous with Africa, so this will to the entire world.We'll live with it for years to come.My thoughts though!!!",malaria,1
30434492,"ok grandpa, I left aw much i care in the papers of d waec am never gonna write again. So u might wanna use ur time for sometin useful like curing ur tuberculosis.",tuberculosis,0
34909881,go for a typhoid and malaria test,malaria,1
88363094,"Malaria,Cough,typhoid are all known to be Covic19 Nigeria is just a wonderful country",malaria,1
65860572,"Lol, please rule out medical issues first before going that route. It may be something as simple as malaria sef",malaria,1
72790430,there's something more than malaria that killed him,malaria,0
86685028,"Stop this rough play, lol. Even malaria is taking us out not to talk of Coronavirus. I mean with the way they are talking about its effects.I hope it's true though.",malaria,1
9375718,"It still doesn't stop you from hearing those their annoying whistling sound that makes you slap yourself, let alone the pain of their bites. I actually fear those more than the malaria itself.",malaria,1
99807237,"Malaria and typhoid are the biggest diseases in Africa.If hospitals can adequately handle those two diseases, millions of lives will be saved yearly.",malaria,1
72139307,na stroke go hold those your eyes,stroke,1
72904396,NO BITE NO MALARIA,malaria,1
93245233,Greed is what is driving the Doctors?You think it's only Nigerians that are working in the UK or the US?You want them to be treating Malaria and Typhoid all their lives?! Crap!,malaria,1
65300985,"u for use that 500naira buy malaria drug or buy the girl some biscuits...the way wey this ur game go take cut eh,I just pity youAnyway,I wish you good luck",malaria,2
86870201,"Lol. You are a woman, you are only going to get blamed or advised to tolerate. I hope you are not planning to divorce him?I would never divorce a Nigerian horseband, not when so many men die of heart attack and brief illnesses.",heart attack,1
10140393,They are simply afraid becos you may transfer malaria infection to them.,malaria,0
69859841,"Please,my body temperature is above normal.My breath appears to be very warm.The worst is that my feet and warms recently begins to feel so so warm.Im not understanding again.ive undergone malaria and typhoid treatment recently.What could be the cause?My mum use to complain of warm foot previously.",malaria,0
63533169,I don't suffer from malaria.,malaria,0
106184785,"Just say ""New Heart attack / High Blood pressure Centre for Women Coming to Lekki in October""Many lekki housewives will run with their children before the center opens,",heart attack,1
90707367,You are proving my point. I believe you and I did not have to wait until I got to know someone who died of Malaria before I believed. My point is that it is foolish to wait until you see someone affected by COVID before you believe with all the other glaring evidence on ground.,malaria,1
56131320,Different stroke for different folks.,stroke,2
66833498,"Dear mama o don't know of this will be useful, after giving birth I couldn't eat, and the doctor treated me for malaria and asked me to take rebena for appetite. You can try rebena might work.",malaria,0
83647180,hmmmmmm...... She complained of malaria? do people complain of malaria? when does malaria turn to symptom? well she died of ignorance and probably self medication.... may her soul rest in peace........ PLEASE GUYS Always seek for medical help ASAP......,malaria,0
80276397,Hope you are using original Malaria drugs...,malaria,1
89651848,"Even if covid19 cure comes from Europe or America and contains artemisin....it would still make malaria causing parasite (plasmodium spp)more resistant to it..If the drink from Madagascar is the cure, it shouldn't be cancelled because of its ability to make malaria resistant",malaria,1
1074400,So many peple suffer coronary heart disease(heart attack) and they associate this to increase in cholesterol which is very wrong. It is caused by the kind and amount of fatty acid they take.,heart attack,1
8970215,"You guys go give person Heart Attack o! Am sure our good ole ""Joe"" must have fainted at the news. Just hope the SSS dosent show up on Nairaland o",heart attack,2
60633257,This is a baby with zica virus. May God help us. Zica is carried by mosquitoes just like malaria.,malaria,1
52898307,Women also suffer from it.My aunt died of a stroke many years ago.,stroke,0
7048645,What is lovely about this picture? All those babies lying around like piglets? This spells doom and early heart attack for the husband (or whoever he is).,heart attack,2
72942723,"You love money. If am expecting an alert, no sleep for me too. It is only that time MTN will want to gimme heart attack with useless spamming messages. My heart will be racing for no just cause. Even if I switch off my phone, I will involuntarily switch it back on.",heart attack,2
38292535,"the lazy Zulu people at it again. she doesn't want to do anything, just sit at home and be stealing from people. God of Israelites is alive. she will soon die of stroke.",stroke,1
2137957,sILENCE from the woman fit give the man stroke oh,stroke,2
48052255,warts?? any idea on why it cmz out my mouth region aftr every malaria illnes I suffer from,malaria,1
24512149,Pls what home remedy can I use to cure malaria?,malaria,1
25338865,A person can't even dare to have malaria now cos he'll be considered an ebola patient.....what a panic-striken Nigeria!,malaria,1
11473057,"IAL/ i ain't laughin, HAFL/ Heart attack from laughing.",heart attack,2
75368936,"Good morning,I will strongly advise cupping to be done in conjunction with natural herbs.Cupping is very important in stroke recovery.",stroke,1
37672965,Please can someone tell me any good malaria drug a nursing mother can take.,malaria,1
1260176,"I don't really understand the implication of lighting a candle for the dead,but I wish to use this medium to remember my late sister.U lost the battle against malaria 2yrs ago.Maybe I could have helped but I didn't try enough and I'm very sorry about this.Pls rest till we meet to part no more.",malaria,0
90888714,Thank you guys.Thought you wanted to leave corona virus and malaria patients to their faith.If it is only the free malaria treatment we Nigerians say thank you and as per the coro please be careful so as not to get infected too as you treat corona virus patients.,malaria,1
4122311,na ya brain go get malaria haba u no even sabi pray xcept to curse 4 early mor mor,malaria,2
14028395,"Ok then,Remind your doctor to rush a IV Quinine Sulphate drip in you when next you have malaria.",malaria,0
27514625,Thanks mamas on your advises. I'm taking paludrine for malaria <user> and i'm feeling better now. Thanks.I wish y'all mamas <user> + safe and smooth delivery. The Lord is your strength.,malaria,0
36205107,dude if you don't want the malaria to occur again get berry nectar and immublend these products worked for me and is still working..,malaria,1
30082247,"e be like say....agbo come get malaria that day, and he was writing exam. if I remember well.",malaria,0
11735690,"Snoring does not cause stroke in any way. The only logical link I think is that snoring is commoner among people who are obese than non-obese individuals . Obesity is one of the modifiable/treatable risk factors for cerebrovascular disease and stroke . Other treatable risk factors are hypertension, diabetes mellitus,smoking,excessive alcohol consumption etc.",stroke,1
13175008,Aye! Though I'v never gone to check my genotype due to the fact that my parents have same genotype -infact all my siblings have same too...and my body is weak to resisting malaria..,malaria,0
46914384,Is that available in Nigeria & is it recommended for a 3yrs post stroke patient undergoing physiotherapy,stroke,1
29603307,Antimalaria is safe frm 14weeks but pls ensure u hv a malaria parasite test done b4 taking any drug.. all the best,malaria,1
71362733,NO BITE NO MALARIA,malaria,1
102088203,"you will die of heart attack, soon. Start trading so you would reveal your true Identity. Do you even care to know what I do to get PM. Useless alcoholic",heart attack,1
90315613,U obviously don't know and u dont want to know.. U know u had malaria then y going to d hospital and not buy drug and treat urself..Stop pride.. U know nothing,malaria,0
108916644,"Nice write up but messed up with coming of christ...Covid19 is just a scam. It's an advanced form of malaria.It's hitting the White hard cos in million years, they are not exposed to mosquito.Ebola is more deadly than Covid-19.",malaria,1
24394027,"NO, not all mosquito bites will result in malaria until there are symptom of malaria there is no need for treatment. To avoid the mosquito bites, get a mosquito net but if the net is not comfortable, you can use mosquito repellant cream or paludrine one tab daily. Cheers",malaria,1
26024971,"Not goof counsel bro. If her life is at risk no? OP go see a prominent GP, you'd be fine its probably early Malaria symptoms or something.",malaria,0
74095485,i wonder oo!! here i am thinking that the guy must have had a heart attack.,heart attack,0
55909351,"Only if Malaria can be eradicated by killing the vector mosquito, the world will be a better place",malaria,1
45018301,Use of mosquito nets goes a long way in preventing malaria. James Ibori distributed some very good ones those days.,malaria,1
89081433,No one will tell you to discard it by the time you suffer heat stroke,stroke,1
14490760,Did you know??Drinking water at the correct time Maximizes its effectiveness on theHuman body :1 glasses of water after wakingup - helps activate internal organs1 glass of water 30 minutes before a meal -helps digestion1glass of water before taking abath - helps lower blood pressure1 glass of water before going tobed - avoids stroke or heart attack,stroke,1
17398842,"Oh but of course, no warrior must smell malaria, that's why they have to take their prophylactic drugs regularly and diligently.also, they must use insecticide treated nets, maintain a clean environment and eat healthily!!!!!",malaria,1
46473698,"Who's scared of mosquitoes? They play with me every night.They sing and caress my eyes, but don't bite me.When they go beyond their bounds, their stings, at best,cause slight itching.I've cooked my body, so much so that I can't have malaria fever.",malaria,1
39886699,"The doctor said it is malaria, don't knw d name of d drug o",malaria,0
26940124,U dey mind am. Is either he's high on glue or has cerebral malaria,malaria,2
103687705,Covid is the new malaria.,malaria,1
46567623,How will I know I'm having a heart attack?,heart attack,1
11268546,LOL- you are right I don't know where he's getting his information from. SS carriers cannot get malaria. hence the selective advantage.,malaria,1
41270940,YES O! APC zombies will die of heart attack when they see dis.,heart attack,2
106722528,My genotype is AA and I don't treat Malaria that often.,malaria,0
