post_id,text,disease,label
43534153,"Which period are you referring to because since time imoriver, u can buy 'all' drugs from chemists without prescription. Infact they mix all kinds of coloured pills for everyday illnesses like malaria, cold, etc.its called 'mixing' As for fake drugs, there are more fake drugs in the 90s than now courtesy Nafdac.",malaria,1
86632198,"Mad people. As if this is the most logical way of funding research. How much have they proposed as prize money for the researcher that find the cure for malaria. ""Awon were dede yi""",malaria,1
98139629,Believe me I see people that malaria have killed Have you ever heard of cerebral malaria Go and research before coming back to me,malaria,1
86285267,God please dont listen to this idiot he no get sense!!! we can't handle ordinary malaria and typhoid na corona virus we wan come handle...abeg make the virus remain where it is.....,malaria,2
82665982,"Is malaria...with plenty fever but it has stop nowI don't know wat malaria has in me, I used to treat it every month",malaria,0
102071353,"He's ignorant,let him get it first and let's see how he continues with his motivational speech Or let him tell us the more people who malaria kill,ignorance is evil",malaria,1
91504744,"That post you made in march has always been my position. It is just unfortunate that most Nigerians are bandwagon inclined. People are just screaming ""lockdown, lockdown "" ..Even the WHO has said corona virus is here to stay just like malaria and co.",malaria,1
94618808,You're on point.. The malaria immunity helped a lot.. That's the advantage we have gotten from been in malaria endemic country,malaria,1
18604761,D death of my dad on the 12th of june 2013....he died of stroke,stroke,0
9143468,"Different stroke for different folks, But if l may ask,when did u start giving ur dad money?",stroke,2
108890836,TOTAL CURE OF STROKE AWAIT,stroke,1
105035886,"I believe this started after a brief malaria illness, ryt? Jux get those stuffs stated above, and start using. If others can survive this, we will survive it too. Stay strong, and remember you are not in this alone. Mine has been 4 days now.",malaria,0
106541278,bros take am easy na.this is not malaria o,malaria,1
80415601,The medicine I reacted to is CHLOROQUINE. It will itch my body for three days after ingestion or injection. Thank God to the discovery of ACTs to treat malaria. I no longer have to take chloroquine.,malaria,1
108314410,"[quote author=GodHatesBigots post=108299917][/quote]Whatever don't bring your so called malaria vaccine here...cos it's not a vaccine and you admit it is only 30% efficient, meaning it is a useless chemical mixture",malaria,1
32124606,"lol......see this one. Please don't die, you sound like you're abou to have a heart attack This is a faceless forum don't forget. No go carry high bp....chai! Such uncouth people everywhere you turn. Una dey shame me",heart attack,1
40382551,For those still doubting if the mosquito lamp is working. Below is a review from someone that I sold it to. Order for yours today and see how mosquito is totally out of your home. Protect yourself and children from malaria today,malaria,1
87784625,And who says there's no cure for malaria. Keep writing off your country and expecting the best at the same time. Confused human,malaria,1
107705490,"It may not work for you my friend...Also Learn to chest your challenges too, so that the day monkey go lost for market... U no go get heart attack",heart attack,1
97205651,"Please anybody that has used Alimosho general hospital igando, lagos, should let me know if they open on Saturday pls. I want to go collect my test result for malaria and see Doctor tomorrow because this malaria is showing me shege . I dont think I can wait any longer",malaria,0
16160711,"she reeled out its health benefits, d one that got me most is it being a potent anti-malaria drink when mixed with hot water. got 2 cans from her & it really worked wonders. gave a friend who was recovering from typhoid,it was like magic. Google it!",malaria,1
81328709,Y him mouth kon wo like say him get stroke,stroke,1
79157667,..AA are most susceptible to malaria because the life cycle of their RBC offers enough time for plasmodium Spp to complete its life cycle..,malaria,1
56835793,"I didn't experience throwing up,but I felt a little sick for about 2days. it was fansidar I was given. What malaria drug were you given ma. Congratulations to folash , I am always so happy seeing my sisters from the ttc thread. You are welcome in the name of the Lord.",malaria,0
96611909,Good morning mamas..The thing is my yard people have been saying I have body temperature which me myself can't really feel so I want to ask if it's normal a pregnant woman's body increase in temperature on its own or it's a symptom of malaria.,malaria,0
100058636,please this malaria drug is d same with Sunday Sunday medicine they give us ?,malaria,1
93392300,This sounds like a side effect of hydroxy Chloroquine. Have you been taking hydroxy Chloroquine for your malaria and typhoid?,malaria,1
107973060,65 new cases of Covid-19 Malaria &Typhoid.,malaria,1
44165683,"May your mother die a miserable death if you dont post the pictures. You will die of heart attack cos you are fighting the wrong person, may all your family and tunde salam die by tanker accident. Say amen! First class mumu. Lmao",heart attack,2
17844432,Cerebral malaria.,malaria,1
44185189,"Baba eku ise ooooooo. ejowo efu wa ni ogun stroke todaju fun eniti stroke dadubule, ki iwosan ati alaafi le de ba.",stroke,1
16700201,Common things occur commonly. First thing on that list should be Malaria,malaria,1
68406378,You are not supposed to take blood tonic or fruits when you are treating malaria it makes the drugs ineffective see a qualified doctor,malaria,1
20361975,"It's still an artemisinin derived drugs. There are other malaria drugs.Nigerians av this issue with drugs, they overuse a drug and it becomes resistant. smh",malaria,1
34224187,"My dear I dey manage o,I'm treating malaria o...Thanks 4d mention",malaria,0
88218397,"Even malaria changes urine colour, talking from experience",malaria,1
88945224,"Your problems have just started. Shebi there is no Corona in Kano, it is ordinary malaria and typhoid killing you people? You'll have sense by force.",malaria,1
1279789,"Dangote has a Foundation, just that he does not make much noise about it. It is committed to Fighting Malaria, HIV and AIDs, Infant and Maternal Mortality. They have project sites in Lokoja and Kastina. They are expanding their activities soon.",malaria,1
3005223,"haba,, wetin make u talk tuberculosis nw?roki, over to u ooo",tuberculosis,1
19251149,Baby just swim around Olympic sized pool once or do a butterfly stroke from end to end and then listen to the sound on your body. It is effective and yet not aggressive. The water takes care of a lot of things.,stroke,2
3859401,"<user> me be case?Abi wetin I do to the bobo? e be like say he wan stroke our love fire LOL, welcome back. Nothing do my ID",stroke,2
714392,"Procold also dangerous, and continuous intake leads to stroke?How authentic is this? any links to prove ur story?",stroke,1
108033914,"This is it! The land grabbing kai kai and Ogogoro malnourished Ijaw pipeline vandals from malaria carrying mosquito infested creeks in Gbaramatu lies have been intellectually busted once more.With this piece of information,The whole world now knows that Bonny and Opobo belong to the Igbos and Igbos alone.",malaria,2
43216698,U wan give them heart attack ni?,heart attack,1
55545831,It's to prevent malaria in pregnancy. It's safer to take it. Please take all meds given,malaria,1
36217052,"In dept source revealed that, if mosquito bite person weyh get the vaccine, the misquote go die sharperly sharperlyspread mat, sipping alomo in grand style. na malaria vaccine too",malaria,1
108385847,"Good evening sabi mamas,Please what malaria drugs can a breastfeeding mum take? Don't jump and pass abegCc: sugah",malaria,1
97478650,"Me block head i don't know ooo. You must be vert smart i be block head.Sometimes u run too fast, stay calm and drink some cold water. So you wont go and have heart attack at a very young age",heart attack,2
36554320,"Africa, your white gods've blessed you again. Soon they'd start exporting the malaria vaccine and keep us permanently under mental slavery.Keep looking to the skies for your endtime while they keep pumping out technologies to maximize human comfort.",malaria,1
43481476,Chai..She would probably die of a Heart Attack that day.. Imagine her grandson is MadCow..,heart attack,1
13710622,"Thats the koko,also use that watchword so as not to have heart attack.",heart attack,1
27538070,"Even after taking anti malaria drug, you still have to use paracetamol..",malaria,1
102213433,Use activated charcoal instead even doctors recommend it at timesAnd the fact that your immune system have grown over time to fight malaria a butty guy shouldn't try what you are trying because it may not end well,malaria,1
90251264,We all know the figures are under reported... Make dem sha dey report am small small like DAT until the cure is found before dem give us heart attack,heart attack,2
19373521,"It has been explained sha..except the part where you say people thought you are SS.There is actually a notion that people who have the SS genotype are less likely to have malaria because of the sickle shaped red blood cells, which is unfavourable to the growth of the parasite.",malaria,1
85867568,"Well different stroke for different folks, I know a friend who do Uber bolt on weekend only , yet he make around 15k to 25k for the 2 days. He owns his car he prefers this to giving his car out on HP since driver go dey tell am story to deliver 25k for 1 week.",stroke,2
76135736,You have malaria trust me.What are you using to generate this feelings?Defeat has started making you hallucinate,malaria,0
61667103,I just wonder oo. Is this how one indivisible Nigeria will take and survive. I think that Nurudeen should go for malaria test. He is sick. Nonsense,malaria,2
17208874,My little cousin died of Hepatitis few month back cos it was not detected on timeThey whre busy treating him of malaria,hepatitis,0
27407659,Thanks tchiwinnie. I tried the lemon water + honey and it worked wonders. I'll go for the malaria test but someone suggested paludrine. Don't know if anyone has taken it before.,malaria,0
87901523,"After TB, malaria is the highest killer in the world",malaria,1
20400160,[size=16pt]Some APC E-rats will die of stroke tonight [/size],stroke,2
14203191,"Pls can anyone recommend the most effective malaria drug I can take as single dose? I don't have malaria yet, but I am starting to feel the symptoms, and the mosquitos in my house are getting more blood thirsty every night. Thanks.",malaria,0
60783675,pls i have being having this resistant malaria for a while now. It does not response to any anti malaria tablets unless i take chloroquine injection but presently the chloroquine injection is beginning to fail me. pls what do u suggests for me as i dont any drug to fall back upon.pls i need good suggestions,malaria,0
40224326,Take your baby to the hospital. It's likely malaria. Or you can also go by your doc friend advice and give the coartem tabs for babies. There's one for 3mths and above. The tabs worked for my DS when he was 6mths and had malaria.,malaria,0
100094203,Fake fake fake Na Malaria we get for NigeriaSCam Covid,malaria,1
55939100,"Almost a whole page of ranting nonsense without addressing/answering the obvious question: what exactly is the problem with using Chloroquine for Malaria treatment?Naija journos, na wa for una o.O pari",malaria,1
5724082,That's a tough one for some but the ones at my place have night-vision goggles and gas masks to avoid getting killed by insecticides. I hope these new-fangled vaccination mosquitoes also come with a mandate to kill the malaria-carrying ones,malaria,1
33902355,"mumihaja, what malaria drug were u given cos erythromycin seems safe even when pregnant. cingrats in advance",malaria,1
46329894,Na wa ooo all this militant una wan give Buhari heart attack?Buhari when we know as BABA GO SLOW don become BABA GO FAST.Him don run go London because of una him come dey lie say him get ear problem.,heart attack,1
1709587,Actually d malaria thing wunt make me give hm a piece of ma mind. Dat waz d only modification he did to the joke after its been posted her 2twice.,malaria,1
2307078,titi o Bleep up gan ni . ti mo ti lo duro de e ni abe igi orombo since yesterday. efon je mi gan infact mo ti n ni malaria.,malaria,0
37812676,AA are good in term of sickle cell but not good when it comes to Malaria,malaria,1
14499573,Kanu is malaria medicine 'Ewu',malaria,1
44643625,"#am interested in this,statistics had shown that the common sickness in Africa is malaria and typhoid. I need to know!",malaria,1
78547116,"The military don't allow. However, malaria is also a disease if there is no drugs. HIV/AIDS may be recruited into the non-sensitive part of the Army jobs",malaria,1
11821160,"Malarial infection is caused by plasmodium spp transmitted by female anopheles mosquitoes. Prevention is by thorough cleaning of surroundings, use of mosquito nets, avoidance of water logged environment and prompt treatment when the infection is diagnosed. Which one do u prefer; natural preventive measures or drugs in combating malaria",malaria,1
34235550,<user> tanx a lot ma'am.I say a big Amen to d prayers.I hope so too.I will get tested for malaria today and see my Dr.tnx,malaria,1
82251434,but y does your master run to London to treat malaria when we have leaves here that can cure him,malaria,1
95292736,"Wow, asiwaju is back, na big heart attack be dis",heart attack,2
99880050,Soul lifting discovery? You should Covid 19 vaccine and malaria treatment.If fake malaria drugs were allowed to proliferate that means one may not get well.Better be grateful.,malaria,1
69971957,"Yaaayy, up TEAM JANUARY, the new year, new breakthrough, new testimony, new blessings, set of people. Thanks capo, SO sorry about the malaria, you are healed in Jesus name, Amen. Please nobody should find trouble ooo, hahaahhaahahaha. It will surely end in praise.",malaria,0
88056910,"Exactly. I pray no one has malaria or thyphoid this period. If u dont get the medical assistance in due time and u die they will say its corona (mind u, thyphoid kills very fast)",malaria,1
93499423,Possibly! It will also do same to malaria,malaria,1
90715821,Baba... You don take better malaria drug?,malaria,0
90412127,"Yeah, I had malaria last week and am having same symptoms now",malaria,0
94550433,"after treatment, go for a lab test to rule out resistive malaria and typhoid. Or you can consult a med doc. Is good to be scared, but don't be too scared, is bad for your mental health",malaria,1
78898496,Do you have Hiv/aids test kits ??and also Hepatitis B Test Kit?? How much is it and how much are they per test,hepatitis,1
108826790,"Well I may be wrong, but it may be a sign of a stroke coming. First of all check her sugar level to know if she has diabitis.Then enroll her in a physcio therapy at a general hospital. Its cheap there. She goes twice a week for massage.Good luck.",stroke,0
42949088,Preventive anti malaria frm 12wks n d ladt dose not later than 36wks.tt u take wen u feel quickening/baby kick buh frm 18wks n last dose abt 36wksI pm u. Reply both. I changed d old email I used to pm. So I cant contact u.,malaria,1
91140369,This is a serious case.....i have treated malaria like 2 different times with ciprotab and it keep persisting with the signs after like 3 days.....the drugs we have cant completely wipe out the toxins out of the body.,malaria,0
97343593,"I believe Corona virus exist but it's quite political in Nigeria.. The Kwara cases get one kind.. People are now afraid to visit University of Ilorin Teaching Hospital, any malaria symptoms na Corona virus patience hahah",malaria,1
8458335,"who come snap this guy put im pic for web? poor guy. for im mind he dey enjoy, he no know say peeps dey dey stroke am.",stroke,2
62056344,Actually Naomi14 and spiceeamiee are right. Malaria is one of the indications but not in all cases. Just went to dig out my class notes,malaria,1
39417028,Playing Heart Attack By Demi Lovato.Ease-Up Punky,heart attack,2
49223043,"You did not have malaria, just the symptoms (fever, headache...) just a glass of water and good sleep would have cured you.",malaria,1
29971451,some people will die of heart attack after febuhari 14 seriously.,heart attack,1
63451608,"Life¬†is a Canvas. Every¬†action¬†of ours is a stroke of paint and at the end, how beautiful our painting is will depend upon all our strokes, all our¬†actions.",stroke,2
6386994,Ms. Cole probably didnt have malaria. Mosquitoes also transmit DENGUE FEVER.,malaria,0
29107582,"Malaria carrying mosquitoes bite at night, sleep inside your insecticide treated net every night to protect yourself. For A Malaria-Free Nigeria. Play Your Part!Happy holidays!",malaria,1
2574149,if am alone on earth? hmmmn i'll just take my time and enjoy the moment with daddy long stroke swinging freely without fear of being heated up in some horrid boxers and dye of boredom,stroke,2
74079687,Might be stroke,stroke,0
107247250,Loss of weightPot bellyNot so fresh skinPimplesSnoringTirednessBody achesLess productive daySleeping disorderProne to malaria or underlying health conditionsMemory issues,malaria,1
9631881,Tuberculosis Joshua Haba!!!,tuberculosis,2
98241904,"So malaria is now covid, our medical doctors are no longer competent to know what malaria is, very soon even head ache will be covid.",malaria,1
63531595,At least Lonart and Artesunat have been saving your sorry ass from malaria nearly 2 decades now.,malaria,1
99235379,"They hate her but they want to enjoy the fruit of her labor, never. Allow the dead to rest in peace, they will not listen, now person done die, person done suffer stroke join",stroke,0
59079065,Benue state still has much positive patients... It's like malaria out there. God help ya pikin o,malaria,1
26440405,"Ahhhh AMEN. So shall it b in Jesus name,amen Satan has attempted. My FET is tuesday and malaria has knocked me down. Anointing has broken the yoke of rubbish sickness o!",malaria,0
77075691,Go and treat malaria,malaria,1
60917190,"OK dear, just give him enough vegetables, he'll be fine. Malaria can be terrible sometimes and unpredictable. to him",malaria,0
5245537,"It's very easy for teachers to punish students 4 wrong doing.but they alway dn't knw d consequences.especially in cases where people get punish under the sun,which is the easiest form of developing skin cancer.cancer kills as much as aid n malaria in our present day",malaria,1
32779257,"Malaria can b harmful to ur baby. See ur dr and do an mp before taking any drug. Depending on d severity, there re drugsa dat re safe for each stage of pregnancy.",malaria,1
102778615,High Blood Pressure ? Heart Attack ?,heart attack,0
50151528,n by d way i used a malaria drug n it reacted same way,malaria,0
98074733,There's no such thing as Covid-19....The entire symptoms of Coronavirus is all related to Malaria.....They don't want you testing for malaria no more but to be testing for Covid-19.... How silly.They're now attributing all deaths in the hospital to be caused by Coronavirus.,malaria,1
68830343,Sorry dear for the indestion it ll get better. Omo the weakness nor be here. Me had malaria and small typhoid that I have been battling with plus the morning sickness it was something else but thank God now am better.,malaria,0
105708998,I am sorry for your loss. However I would rather queue up to take malaria vaccine than covid vaccine. Every health mishap is now attributed to covid 19.,malaria,0
64430104,Nigeria is dysfunctional because ibos could not see beyond their noses. They tried to use violence to get what they could have gotten with the stroke of a pen.Act first and think later.,stroke,2
24535919,"W.H.O banned arthemeter used alone. The current treatment of malaria is ACT (artemisinin-based combination therapy) which includes arthemeter/artesunate/dihydroartemisin PLUS A SECOND DRUG. I'm pointing this out cos arthemeter is still being used but in combination with another drug like lumefantrine, etc.",malaria,1
38730577,Continue taking the drug till you clock 0+ ok? and always sleep with mosquitoe net ok? also take immune boosting drug or eat fruits always to help boost your immune system so as to fight the malaria parasites ok.....SHALOM,malaria,1
82984317,"Sis I will advice u wait o the malaria drugs if you are already in your TWW, might be Omolaria and not malaria",malaria,1
74853327,Some people will have heart attack,heart attack,1
107778342,malaria in pregnancy is an anomaly.,malaria,1
24446524,Pharm Greg....the point isn't about knowing the treatment for Malaria....its about knowing it's Malaria. while I really doubt if it's any difficult to manage malaria....the problem is what if it becomes a complicated one? That's why there's need for a job description in the health sector,malaria,1
16770302,"in nigeria?hahahaha - it's more common than malaria. we all know naija women can sit on any toilet seat when pressed. men can stand from a distance and aim. thankfully, women cannot.",malaria,1
47512540,You do realise most drugs in the market don't take care of malaria like it used to. I advise you take her to a good laboratory and run tests. They will recommend the best drug to wipe it out. Cc TChwinne,malaria,1
18694881,na wa so they are about to find a vaccine for HIV and malaria and they are working and spending tirelessly on other ground breaking researches around the globe and Nigeria is still trying to figure out how to give 24hr electricity after how many decades,malaria,1
105472688,Awesome! Google is better than 90% of Nigerian doctors. Bunch of scammers guessing symptoms and diseases and prescribing malaria drugs Everytime.,malaria,1
46964096,Have u had any case of malaria?,malaria,1
49916841,"E remain small. Joomie, please massage the breast with hot water, put cold cabbage leaves in ur bra and keep putting baby to suck that breast. You will be fine soon. It's probably the pain from the engorged breast dats causing the malaria like symptoms. I had it too.",malaria,1
87300928,"bullshiit! where was God when Ebola was killing Africans, malaria, Thypoid, cholera and starvation has been killing Africans in the last 20 years where the hell was God then?.",malaria,1
78361839,"Dear Op, You want to kill yourself because of staphylococcus? What will you say of those with Aids, Herpertaitis A-Z, Cancer of the Lungs, Breast, Kidney, Chronic Diabetes, Stroke, Migraine, and Poverty?",stroke,1
42850949,What do you mean? Can you wish yourself stroke?,stroke,1
98941251,Pls the guru in houseAny 1 can recommend gud drugs for stroke treatment.Herbal or medicine,stroke,1
29948052,CRY ME A RIVERNA WETIN THE CAMERA MAN TELL YOU?PRAY TO GOD MAKE HEART ATTACK NO CATCH U DIS NIGHT,heart attack,1
68392389,OK you're doing alright. Don't fall ill I beg. Malaria pack your kaya from WhyworryPH's body now now! It is well with you dear.,malaria,0
78133447,"This igbo man won't rest now, money doesn't save heart attack all the time.",heart attack,1
76701103,"baba i noticedMehn i was down wif malaria.......where dem Lhimeet ,chief,betpawa yehmy Fadire eduzz qualitygod mavor and so many others na",malaria,0
73746217,shut up! Your a Yoruba Muslim. Your claim urhobo but still suffers heart attack on a thread made for afonjas!,heart attack,2
62712974,"You have shortage of blood together with Malaria parasitePcv....that means you have been perseverance ( u have bn persevering)You below me nack am injection x 3days, P-Alaxin 3,3,2 ,1×3dys with Pcm 2×3 for 7dYs",malaria,0
476828,"In all honesty, they don't want the blood of anyone that has been infected with malaria.",malaria,1
57450407,"So fill circle back to the place this conversation started. Cardiac arrest and heart attack, are simply cousins from the same mother?",heart attack,1
53459071,"don't be naive , he did it for me and you... you criticize him and enjoy the outcome of his experiments.. today you can easily walk into a pharmaceutical shop and get drugs for your malaria and poison.. you think these drugs were conjured in your churches ? Grow up please..",malaria,1
37131703,"Lol. Na Benin u dey too? D rain no b small. I came down wit malaria, d doc prescribed coartem saying its safe during breastfeeding, but I've refused to take it since I read d leaflet. Looking for safer option",malaria,0
34037427,I am suspecting this to be a case of CEREBRAL MALARIA. Even at that the death of this young man was just too sudden.,malaria,0
29614708,"Diarrhea, typhoid, malaria, ulcer in the making",malaria,1
91799466,"Dude, majority of covid victims All over the world recover without treatment. Taking malaria drugs for victims in Nigeria helps to clear any underlying plasmodium parasites so the body's immune can be strong enough to fight off the covid.",malaria,1
17644143,"hahahahahahaha.........LWKMD! Kai Sincere9gerian which one be ""hate induced stroke"" again? You sure have a way of touching this people where it hurts.",stroke,1
13608371,seriously? this would cure stroke? please give people real information beg. Any one with stroke should see the doctor. Food does not cure stroke,stroke,1
58439664,It could be he took a direct flight which encountered too many turbulence which his heart couldn't take. He must have had a heart attack. It's not village people at work ooo,heart attack,1
34212377,"Mama, its false dat u cant tk malaria drugs if u test positive(significantly) cos d malaria can harm ur baby if left untreated. There re safe drugs for ur stage. Pls go to d hospital and b seen by ur dr.",malaria,1
