post_id,text,disease,label
6326913,"no derailing allowed abeg, because you don recover from malaria we no go hear word again",malaria,0
104469708,"Omo if ona wan help am, make ona help am nor be to dey stroke am finish.... He has learnt his lessons, u want tell me say all of ona never make mistake before nor be through that mistake u take get sense",stroke,2
19727622,"Howbeit. Unbeliveable. Sugar, soft drink, stroke",stroke,2
12993759,"Omo, u better go for malaria test asap. Packing mosquitoes in batches?",malaria,1
63672507,"I used it yesterday for Amosil Beecham drug, no response yet and today for Lonat malaria drug, no response still yet.",malaria,1
79077991,"Glad to hear you feel better...Quinine products are actually drug of choice in first trimester but if you are not comfortable with it , please talk with your health care provider.However, was malaria parasite test done before the drug was introduced??All the best sis..One love..",malaria,1
57703903,You are right.I am sure some of them will die of heart attack even before biafrans exit.,heart attack,1
72138730,"He probably was poisoned. A 32 year old just doesn't die from a heart attack unless he had a pre-existing heart condition or was taking heavy drugs, but more likely his drink was maliciously spiked with a deadly drug.Russian people do not like black people.",heart attack,0
93192143,kogi has shown us Covid 19 can easily be fought like malaria.,malaria,1
108308264,Just to remind people that malaria is more deadlier than corona virus,malaria,1
90378680,"My man you've said it all. Corona virus is a glorified malaria in Africa. If malaria is conducted on Covid-19 patients , I'm very optimistic that all of them will test positive for Malaria",malaria,1
104281166,Feb 23 too. Down with malaria and uti. Dr gave me antimalaria and amoxicillin yesterday. Headache and stomachache is killing. 'Na everything dey do me'. I don't know if you should register me yet sef but I hope God will see me through this. Its not easy,malaria,0
56667608,"Fake people every where, no wonder Buhari always travel to London for medical check up, let him not support Arsenal again o to avoid another heart attack",heart attack,2
63957856,hahaha better stroke for catch am,stroke,1
4053122,The worst part is that the WAIPA is more expensive than the artesunate. In fact its the costliest malaria drug i've bought.,malaria,1
4292492,mama g and segzi you no serious o <user> you feeling any malaria sympyoms? if you're not. then you have to stop taking the medication and seek a doctor's opinion,malaria,1
80044469,Mummy's I am pregnant ohhhhAfter taking banana recipe last month this night it happenedI took pt this evening and behold is positive butBut the problem now is I have taken alot of antibiotics and malaria drugs wat should I do pls,malaria,0
6765841,"guys mehn, am feeling crazy right now, u guys wont believe dat element has just gotten malaria, am feeling like hell right now, d headache, body pain and i dont knw, am just sick",malaria,0
14851391,Depending on the type of stroke. It might be surgery that will help.,stroke,1
25564852,<user> guess the fear is normal. These days once you start having the usual malaria symptoms fear will come too. Cos nobody knows who has ebola so you won't really know when you contact it,malaria,1
63414081,Good morning fruitful mamas Please is it true that it's not safe to take malaria drugs while trying to conceive. Are there natural alternatives. Please don't read and jump pass. Thank you,malaria,1
51283146,Omo Sheffield utd wan gimme heart attack. 2 red cards that still don't wanna score.,heart attack,1
54446828,"Are you doing EBF? I guess you aren't for the doc to prescribe antibiotics and malaria drugs. This isn't healthy atall for a baby at her age, this is why mothers are encouraged to do ebf <user> yes o. She is EBF",malaria,1
76903372,"Hospital straight plsLet them run another malaria test plus full blood countIts well with her mama, pele",malaria,1
64841166,"Wow...Cute bumps everywhere...supernatural delivery to us..Mamas,pls which malaria drug did you take,my doc prescribed coartem,even though my malaria test came out negative..should i still take it? Pls help a ftm.thanks",malaria,0
5695357,"Why take a gamble with that ?People contract hepatitis B and C from tatoo needles why not HIV from clippers? True, its said the virus cant survive outside the body, if want to BELIEVE them, fine.A wise person wld get a clipper of his own.",hepatitis,1
38010726,"you go soon die of heart attack for this Jonathan matter. you better grow up and stop being kiddy. Election is over.and i believe 1 thing. if you get better work, i mean good job, u no go dey talk talk or insult jonathan. what a jobless mumu.",heart attack,2
56461903,I beg this government pls if you have never been serious with anything pls don't joke with this news like you are joking with meningitis. Ebola is not malaria pls. Start puting things in place. I am not praying for it but PREVENTION IS BETTER THAN CURE. God go bless una.,malaria,1
50689154,"my broda, over 1.5 indeed I almost had heart attack",heart attack,1
25062131,"The main types of stroke areIschemic stroke.Hemorrhagic stroke.Transient ischemic attack (a warning or “mini-stroke”).contact us on www,ewejeroot.com",stroke,1
3429908,"JUST DO AS <user> HAS SAID BELOW if malaria persists after 2 days pls, consult ur doktor",malaria,1
46491036,"Preach on sister, preach on. Ikwerres are delusional lots. That Nnewi example is a master stroke, a bomb.",stroke,2
35270646,"This story would have stroke a cord but for the source-Sahara Reporters.A source that of recent has been noted for spreading falsehood,propaganda and blackmail.People should be carefull with news coming from Sahara liars.",stroke,2
14586030,"Heat and Nepa dey fight for my side o, mosquitoes come dey form referee.Imagine heat + power outage + surplus malaria... :",malaria,2
48732344,Take her to the hospital it could be acute malaria and it can generate into high blood pressure,malaria,0
32199869,This guy that announced Bayelsa almost gave me a heart attack mtcheeeew. Did he forget how to call numbers?,heart attack,2
10765642,Am going for a malaria test and will ask for a full blood count. Pls is there any other test I shld do,malaria,0
86685598,Hmmm...this thing must not come naija.....cos na wiping thing. Our facility Neva deal wit malaria finish talk Les of Corona,malaria,2
71705340,"My mum has been down with stroke for 10 years too, its not been easy tho. The same stroke also killed my dad less than 5months when he got sick. Its not something i wish my enemy.",stroke,0
28650898,"good evenning, i went to hospital today and i explain to the doctor exactly what i post here and they run some test including blood test, so he said it is typhod and malaria. But he told me to come back tomorow so that he will check my BP again bacause my bp is high 160/101.",malaria,0
61970850,Thanks mama for the input ma. They ran a test and typhoid came positive and malaria mild. Im grateful ma.,malaria,0
2777421,"Na wao, which one be bulgaria malaria nigeria abeg?",malaria,2
71306812,Give her paracetamol to relieve her of pains associated with teething.You can also get her checked in the hospital to be sure she's not bugged with malaria/infection.Ensure good hygiene around her cos their immunity is usually low when teething.You can also use multivitamin/b-complex syrup to make up for low appetite.take care.,malaria,0
12948598,"What you need is what i call specially treated water, a friend of mine is using it and for the past 3 years, he hasn't fallen ill to malaria. if you need more details, let me know.",malaria,1
47860320,"Scientists in athopia and Sweden discovered that, mosquitoes wish spread malaria tend to run away from chicken odor through research that was conducted. BBC news.",malaria,1
86497941,"It's like saying Lord did not make anything,God didn't create Malaria, malaria was created by humans when they neglected their environment and left it dirty for mosquitos to lay eggs.God is too Dumb to create a thing.",malaria,2
94689646,I was like you till everyone in my family became sick...na that time you go believe say e dey happenYou should know that malaria rarely/never presents coughing as a symptom,malaria,1
67223222,"Foolish copy and paste list!TF can u forget the no 1 illness, malaria. If u r gonna copy and paste, at least be creative enough to add small sensible contributions or u lack sense?",malaria,1
69223400,"Did you do a test before you commenced treatment of the malaria?If it's self medication, then I'll advice you go for a test and make sure you did typhoid test too. such are its symptoms.",malaria,1
79912254,Im in the same situation as you but my baby is 5months. Did you confirm if its neg yet? Im silently praying mine is malaria oooo hmm,malaria,0
98170133,Malarka indeed For a start did you know that Nigeria have the highest malaria deaths worldwide More than 23% of global malaria deaths is in NigeriaTalking of Nigerian adults don't die of malariaDon't get too excited dude Alot of pregnant women die of malariaAren't they adults ?,malaria,1
83845657,"When some countries are celebrating malaria-free, in Nigeria we're adding yellow fever to our malaria. God save us.Allaah ya kiyahe.Meanwhile, ethno-religious bigots will soon flood here with their trash.",malaria,1
35416802,bet lash 16 stroke,stroke,2
63243351,tanx..Buh i v done HIV I nd II test nd z negative..Plz i treated typhoid nd malaria 2dweekz ago..So waht exaktly shuld i go 4..?,malaria,0
18379043,"Hi mummies in the house, i was also given fansidar last week friday eventhough i tested negative to malaria. a dose of 3 tablets and was advised to take another dose in a month's time.Rukemi you r quite funny big boobs vs small boobs.",malaria,0
98032520,"Please can you mention one of the drugs,my friend is battling with depression,due to sickness and financial challenge,his father has stroke and he(my friend) is battling with ""chronic"" headache for almost seven months now,he escaped 2020 i pray he will scale through this year.",stroke,0
80008469,Mhen I dont envy you for the plenty meds. Sorry about the malaria dear. I hope to start shopping very soon..I'll update your EDD asap. Takia teamie and Amen to your prayers.,malaria,0
9354754,"I dunno if the point of threads like this is to stroke someone's ego.Personally, I think most other peoples in Nigeria have more interesting things to think about than Igbos. No offense to ya'll, but the earth doesn't really revolve around you.There are bigger fish to fry.",stroke,2
59011624,I don't think bitterleaf water can cure malaria and itmight not be safe for pregnancy Go to the hospital and the doctor would prescribe a safe drug for you,malaria,1
71748565,okay. i will go for the lab tests and post results. i hv taken several malaria and typhoid drugs cant recall the names anyway...,malaria,0
89047244,Everything in that relief Malaria no pass 500 abeg will it last more then 3 days Confuse people,malaria,0
5381061,fat is disgusting cos it kills a lot giving its victim a heart attack,heart attack,1
105769034,Exactly what a Priest told me. I also have some friends and relatives who have had flu and malaria like symptoms running 2-3 week courses. May God deliver us from this plague. Amen,malaria,0
25487936,"I see what I can do. This isn't the right time for one to develop malaria, since malaria coupled with allergic reactions and ebola have similar symptoms. I think I'll visit the hospital soon, probably by Monday if I don't get okay by then .",malaria,1
16955069,"Dear poster, you are talking lies....I feed on almost everything you mentioned and i'm very healthy than you and your doctor combined.Na una go screen food pass, still dey suffer from rheumatism, malaria and typhoid and all sort of sicknesses.#LetUsPray Jor",malaria,1
43238824,pls mamas which malaria drug is good for a breastfeeding mum?,malaria,1
25350104,Good info i hope people wont abandon someone that is ill with malaria or typhoid thinking the person has been infected with Ebola.It is well.,malaria,1
10410716,"looooool! thats funny!dont blame him please- i added my dad but he cannot see anything but my info page, did that with my whole family, cant be having him getting a heart attack on my fb rants!",heart attack,1
32092985,Please remember to take your medications. Do not forget the doctor's advice: Depression and stroke are silent killers.,stroke,1
30596683,"Hello inhouse doc,Please am gradually recovering from a bout of malaria and typhoid..almost done with all the drugs,but I still lack appetite and find it dificult sleeping,what could be the problem and what's the cure. Thanks",malaria,0
17583799,If you live in Anambra you would've noticed that Ngige has secured more endorsements fromTrade UnionsTown UnionWomen Associations etc Than any other candidate in the forthcoming elections.For the recent Fashola deportation saga its just Malaria at work Political Heavy weights ? Heavier than Ngige ?? Have you taken your pills 2day,malaria,2
104595744,"No more guesswork, be sure of what fever it is, try our Urine Malaria Test kits today, very effective ✌�",malaria,1
46237366,"<user> Nigeria cannot win a war agaisnt the east. This is not 1967, a lot of water has gone under the bridge. Even in the first war, Nigeria too higher military casualties so go and sleep. You have high malaria, look for Fansidar.",malaria,2
12016325,this response is capable of causing heart attack on CyberG. let me wait for his clownish comeback (since he will be foolish enough to reply),heart attack,2
103252135,Wickedness. All this country declaring malaria free. Where dem dey send the mosquitoes to?Oh Nigeria!!,malaria,1
91137186,"You've a point my friend, it's not cool putting other people's life at risk just because we think it's ""ordinary malaria""....... So I made sure I stayed away from any form of physical contact with anyone or anything, except my car and the chair I sat on......",malaria,1
90256641,"you get supplies to last you for 2 months during total lockdown? when awon boys go begin visit your house for 1am ,your eye go clear.there is hunger in the land o, without food your immunity go fall drastically then even common malaria go come finish you",malaria,1
107942261,So it's the malaria melecine that is troubling my body? All melecine stopped for now. I'll try and be taking yoghurt for calcium,malaria,0
36900554,"Your baby needs to get BCG. That is given at birth also, I think. Please ensure he gets it, as it fights against Tuberculosis.",tuberculosis,0
55603472,SS patient is down with malaria... Bro are u sure u know what ure saying at all,malaria,1
36440042,"If u have malaria nko, u won't take drug Hian!!!",malaria,1
43205369,"Actually they don't give malaria drug to pregnant women in early stage, mine was treated by taking drip and they added the injection through the drip, tell are to go to hospital and complain.",malaria,0
8732024,This is a Good Idea which can be further developed to stop the menace of malaria in the society. We can adopt the shocks smell technique first!,malaria,1
38769844,"Hello mamas in the house,av been down with cough and catarh for some days now.and am not sure its malaria cos I. Just treated it a month ago.pls what do you suggest I take?",malaria,0
39164105,DO NOT SPIKE HIS DRINK. any sexual enhancing drug has its own side effects. You could unknowingly give your husband a stroke. It happens! Face the issue head on..,stroke,1
58703169,I just used it few minutes ago. Trying to sleep now so I don't feel the reaction.Don't really know what malaria is looking for again after taking all the required dosageThanks ma'am.I appreciate,malaria,0
85278365,2 weeks ago I had severe malaria and since then the left part of my neck has been paining me. I have not been able to have upto 3 hours sleep since the pain began. Please What could be wrong. Is it that I took a bad drug or something else,malaria,0
93327862,"No, it's been a while I treated malaria and I don't just want to use any drugs as have not started antenatal. Could it be malaria",malaria,0
9591182,"What state are you in? If there is a general hospital there, it will be your best bet.You may also want to visit any private medical lab.It seems you have chronic malaria",malaria,0
59721293,"The thing wan give iPods heart attack, we will still sneak a plane factory and yard on them. They just can't believe Afonja can do it. Eti mo meme.",heart attack,2
14794256,"Truth, but what else...if one does not kill you another will kill you. I have noticed that 80% of those who suffer heart attack and kidney stones are non alcoholics.",heart attack,1
70673279,The tension and stress from his aggressiveness after being told to wait till 9am even though he arrived at 7am (probably left his house before 6am ) made him have a heart attack.,heart attack,0
12341454,damage to the brain nervous system may cause errors in spoken and written english.I know a lecture who recovered from stroke and lost her ability to speak correct english or understand how tenses relate to themselevesher english is 90 percent corrfct so u would just laugh at the blunder without knowing its an illness.,stroke,0
98591300,You only hear about high-profile people. The news doesn't report the hundreds who died from childbirth or malaria this week. Same for covid19.,malaria,1
71585024,"The stroke cannot be undone, you can only prevent further strokes. Buying herbal medications with false claims will not fix your brother, please don't give your hard earned money to quacksters. Get the prescribed mediations, ?aspirin ?antichilesterol ?antihypertensives and help your brother continue physical therapy",stroke,1
13915405,I have been having this malaria symptom for some time now each time i take some of this malaria drugs it goes but resurface again. Doctor in the house which malaria drug do you think is good for such kind of situation?,malaria,0
76428068,"If u suddenly fall down and have stroke, u wont know its because u cursed urself with your useless post.",stroke,1
65301334,When I visited d skul medikI was given some malaria drugs Nd some other drugs as well,malaria,0
99624653,No its science that told me. The same science that told you to use chloroquine for malaria and later developed other ways to deal with it lie Athesunate etc. Said your hydrochloquine or what ever you call it is not the cure for Covid 19.. Simple,malaria,1
101589978,". You are pathetic, if ipob matter no give you stroke e go remain small. Try and be reasonable, it won't kill you.",stroke,1
33552685,Wow! Condolences! Heart attack is the #1 KILLER of BLACK WOMEN.Thanks a zillion!,heart attack,1
38781200,"If no malaria parasite or infection was found , just carry your precious & ruuuuuuuuunnnnnnnnnnnnnn!Nothing like prophylactic care, no bueno...",malaria,1
87594705,the cure is already out now .scientists just announced that chloroquine for malaria cures the virus .corona virus will soon be history before month end,malaria,1
6105941,"you can call me ignorant or whatever if a guy is too lean and doesnt have energy, coughing like he has tuberculosis, scratching his visible rash i will run for my life if they try to chat me up, but people with none sign as in early stage could have it as well",tuberculosis,1
108859349,"If you're battling with any viral infections or diseases either Hiv,herpes,hepatitis,covid or omicron it's curable tradomedically using herbs Check my signature and profile for my works....we deliver nationwide,..my office is in oyo town",hepatitis,1
61393312,"Do tests full blood count, malaria parasite ECG and check your blood pressure",malaria,1
72161775,"You guys are terribly scared. Peter Obi was a master stroke to you people.Just wait till campaign begins, you guys will be torn to shreds. Make una begin fear more more oo.",stroke,2
37905212,the same thing happen to my friend after taking alamal anti malaria play play rashes skin burn when I went to hospital to visit him I almost died of shock I couldn't recognized my friend of 30 yrs like he was thrown inside acid may god punish all fake drug producers,malaria,0
101132559,Happy world malaria day,malaria,1
59427543,"pls dont wait till evening it maybe late, take him to FMC now for more professional solution. i dont think its malaria,",malaria,1
29631476,It will shock you after February when the story change and Buhari wins. I hope you won't have a heart attack.,heart attack,1
44129622,Stroke doesnt happen suddenly like u said. Hw much is ur neolife... and how does it work.,stroke,1
92419323,Do pple really still avail themselves for testing abi na malaria figures them dey give us,malaria,1
44718635,No they don't. You have to give your child BCG here when you get home. Guess Tuberculosis is not common there.,tuberculosis,1
85801987,"Suddenly people who believed the ""prophecies"" of Oyedepo, Adeboye, Tuberculosis Joshua, and Apostate Suleiman are finding it hard to believe those of Mbaka...Some people do choose their poison",tuberculosis,1
62626782,She doing better now. They ran some tests today and it's malaria. Thanks for asking,malaria,0
17321064,This is a great news can't wait for the vaccine am tired of treating malaria. Live and work on top of water..i Can't resign because of the pepe involed.,malaria,0
69607039,No...never been struck by malaria ...prevention is better than cure.....traditional methods of prevention.,malaria,0
93205892,I hope she‚Äôs not infected but the day I got back she hugged me though she has been complaining of malaria before I came. Though I‚Äôm the one taking care of her since we are the only ones at home.,malaria,0
33872093,You want to give some people heart attack,heart attack,1
13381668,and what are the differences between it and malaria?i need expert advice.,malaria,1
9436966,"Sequel to the Eradication of Malaria Program in Nigeria, 63million Mosquito net were distributed accross the Country for free .Have you recieved yours? If Yes Text ERADICATE space YES to 33140 else Text ERADICATE space NO space location to recieve your own free mosquito net one. N50/SMS",malaria,1
89452319,Artemisia (the madagascar herb) is what is used in producing Artemisinin which is used in producing current malaria treatment drugs.Chloroquine is also used in treating malaria...what i will like to know or what i will like scientists to explain is why this virus can be treated with mostly malaria treatment drugs.,malaria,1
53885615,Have u treated malaria lately?,malaria,1
68882528,"""You are borderline for Salmonella Typhi. Titre over 1/80 is considered with significant infection.""Please what does this mean? Does it mean I have typhoid?Plus can I treat typhoid and malaria together at the same time?""",malaria,0
7749020,Your Grammatical blunder is almost giving me a hat attact heart attack.,heart attack,1
4999657,Leave am.Na stroke dey kill them for im family.Na im turn.,stroke,2
18758706,I have not been given any anti malaria o. Am 24wks +. Is that alright?,malaria,0
60083922,Wow its going to be more fun today to the heart attack of the devil...#Faithbumpsunday... #Godwilldoit... #testimoniesthisweek... #praisingGod.now.and.in.advance#Fertilityblessings,heart attack,2
31097559,All is fair in war man. If pdp can play with over 200 chibok girls then.....(i never talk about the thousands that die during child mortality or by malaria or by hawking on roadside cos their govt doesn't give a fuckkk.,malaria,1
35441399,"Your malaria has degenerated to typhoid - Don't worry Mr DEMDEMDIMWIT, at least he has stopped barking like the dog of Ubima, he is now waiting for crumbs from Buhari the olodo General who can't even form an ordinary Government parastatals without consulting Jonathan",malaria,2
89806605,There is nothing FG want to explain on this matter. We already know that those people are not Covid patient rather they are malaria patient. If it is Covid-19 it will show.,malaria,1
14726205,"I think its a psychological thing.More like what you have conditioned yourself to believe.If serious malaria attacks you,I doubt sex will work any wonder.",malaria,1
7123506,"for malaria, you will use kedi quinghao and for body itchin all over the body, you will use kedi reishi.",malaria,1
60988066,Na stroke...,stroke,1
42375453,Which one be Zika again? I'm sure Nigerians would be immune to that cos malaria sef don become part of growing up.Tell me one Nigerian that hasn't been infected with malaria all his/her life and I would show you 100million that have been affected with malaria at least once. Mosquito is our best friend here abeg,malaria,1
59490480,Even me wey no be zombie dey read the article and got scared.... That means zombies will surely have heart attack reading this.,heart attack,1
96948911,Man wey get stroke or man wey get heart attack and wants to live much longer or wants to reduce the suffering MUST look for hyperbaric oxygen therapy -hbotFind out yorsef becos too much grama no dey elp.We are HBOT PROVIDERS .,stroke,1
67608532,He's an inside man in correct score racket and is still asking you for mere 30k? Please tell him to start taking his anti - malaria drugs. He's hallucinating.,malaria,2
62238119,Malaria kill faster while hiv can take years to kill victim.it doesn't show for face and can be managed.,malaria,1
46440819,I just treated malaria and my urine is not yet salty.,malaria,0
52281358,Breathing in out very fast through the mouth is certainly recommended for those who notice that a heart attack or angina is about to happen,heart attack,1
63389637,"visit NaturalRemedyLab for all you need to know about malaria, cerebral malaria as well as effective natural home made remedies.",malaria,1
102096167,Waillers will die of heart attack after reading dis news. Sharia law is here to stay. It's a way of life 4 d average Muslim. Any were u find a Muslim get ready to tolerate Sharia. Case closedMeanwhile somewhere in aba,heart attack,1
