post_id,text,disease,label
106971009,"Your ignorance stinks to heaven. You want to treat/prevent HIV and Hepatitis with antibiotics, right?And just because your forefathers didn't know anything about condoms, should that means you that know about condoms shouldn't use it?",hepatitis,1
56034598,"Why the sad look these days? Abi, him get malaria ni?",malaria,1
9288786,"Just lifted that directly from his/her pc! btw,go check your books again!, pt may have been to the tropics lately!, Remember pts could have malaria months after visiting the tropics!",malaria,1
27133577,"The supermodel wanted to congratulate Malala on her Nobel Prize but mistakenly typed Malaria instead of Malala. She blamed her iPhone auto-correct for the mistake. She wrote ""Darlings my iPhone and I are at odds it seems I type a word it seems to spit out another, forgive me"".",malaria,2
87121609,Men you see your lives. Who’s now the weaker sex.Haven’t you observe what happens when fathers are sick compared to when mothers are sick?The same malaria but father will look like he will die the next minute.,malaria,1
9281313,"60 stroke of (CANE) of that thing wey he dey under your pant we be a nice gift, I think that we make her happy, abi weting u think Mr. Givers Never Lack",stroke,1
7190077,Baby it's always been therealthough hidden under wraps and away from public view but very¬† much¬† still¬† there!¬† If your sure 'tis malaria then don't wait till tomorrowtake something now to ease the pain baby¬†,malaria,0
43878166,"Thanks dear,no plus sign on d result ,Js malaria trophozoite...i hv decided to chill and manage myself till next week.",malaria,0
90361090,"The thing don turn malaria. We have been treating at home. There is no escaping it, it will run its full course before it ends. At the end of the day we will have a stronger more immune society .",malaria,1
20164807,"P.f stands for Plasmodium falciparum, one of the most common malaria causing species. The result shows that the malaria is quite serious and the typhoid is relatively mild. I'll advise the person to go get treatment for both diseases asap.",malaria,1
26373644,"I took a codeine induced drug for malaria treatment,and I remember my head turning 360 degrees and was Jumping gutter that FASHOLA never construct an as I managed to sleep,na so I see my grandmother they chew bubble-gum ;Dand my grandpapa don join boys-scout ...oluwa!",malaria,0
65246771,"by the time buhari wins in 2019, you go get heart attack",heart attack,2
28615108,"thank God it didn't happen in naija, it would have been another malaria case",malaria,1
75051662,Assin eh!! The malaria abi na high fever wey do me the other day don clear.I dey reason typhoid fever now....,malaria,0
59910059,Please is deworming necessary for adults? It's been ages I took deworming drugs.Does it have effect on immunity because malaria deals with me always..Thanks.,malaria,0
58398724,So u want someone that will give u heart attack?,heart attack,1
51097539,"No p,my 16wk was actually my ist visit and there I was told I was due for my TT injection and preventive malaria medicine.being a first timer,you shld make your 1St visit at 12 wks(most hospitals recommend that).",malaria,1
24408518,"Why did he not do the flushing first and ask yu to go try conceiving before proceeding? Mtcheeew. Irrelevant tests..malaria,malaria parasite,hiv, hepatitis A-E lolll. And plenty plenty like that. I know he go see malaria cos I don but lonart to use sef. Lolll.",hepatitis,1
67463437,"we Nurses love it like that. Johesu is fighting fg, you malaria and typhoid specialists carry una busy body enter. That cleaner you are seeing as nobody is somebody and deserves respect which you people are not taught about in the medical school.",malaria,2
50200071,"Try natural medicine, herbs or Agbo it's a reliever even thou it's not the total cure, but you'll feel better. The cure for complicated-cerebral malaria, typhoid or whattevar is only God, miracle! You heard me right.",malaria,1
86288351,Influenza is a normal sickness... abeg. It is due to cold and flushot is taken to prevent it... also it is just like malaria is to Nigerians,malaria,1
16133573,like you have celebral malaria.which kind thwart reasoning.lag and abj na sun rise state of biafra? PG 18,malaria,2
37462941,It shall end in praise.Why IV(drip)? Are you prostrate? You sure say you get malaria? ds one you dey active so. All the best.Really bad manners! Replying every insult instead of apologising and doing the needful.,malaria,1
107918222,How many did malaria kill?,malaria,1
90452108,So now they've open their asses...Do they think we receiving these news are senseless.. How can u discharge 222 people in a day?what drug was administered to them...malaria presumed cases I forgot This corntree matter no fit dey settled gan. SMH..God bless Nigeria!!,malaria,1
1317233,N300m- You guys should go and buy metalkaphin to clear the malaria. Is this a malaria dream or what?,malaria,1
108309286,And they are busy forcing covid 19 vaccine on Africa while malaria is killing millions yet they refuse to develop vaccine for it.,malaria,1
68921330,"Please oooo.......I am 12 weeks and just treated malaria....but av completely lost my appetite, I can't eat or keep anything down.....and I am seriously weak....help",malaria,0
9817622,Dude. When was the last time you were treated for malaria?,malaria,1
14174722,your grandfather wants to make it big as dangote who is presumed the richest man in africa. I think your grandfather has typhod and malaria,malaria,2
106459046,Sleeping inside a treated mosquito net is the best way to protect yourself from malaria.A Malaria-Free Nigeria. Play Your Part!,malaria,1
92971231,Nearly had a heart attack <user> abegg ooo congrats on your bundle of Joy,heart attack,2
82192623,"He may be right! From experience, Doctors and Hospitals advises you take your multivitamins and supplements only after you have completed your malaria treatment! They advise against taking multivitamins/ supplements together with malaria treatment!",malaria,1
105708767,"She got all the risk factors to die in the first place.Coro was just the culprit, as even ordinary Malaria would have killed her still.",malaria,0
18724106,<user> thnks for d postI'm 15 weeks preg. I hv malaria and d Dr prescribed Ogamal for me. I'm scared cos i had miscarriage on d 8th of march ds yr. Though my only hope is olive oil. I dont forget to rub it on my tummy daily.,malaria,0
72023534,Yeah This Pick Is A Political Master Stroke.Hope It Jells,stroke,2
92116887,"Suicidal tendency is a component of depression just like fever is a component of malaria, you dont blame a mad man for dancing naked pn the street since he is not in his right state of mind though it seems stupid.",malaria,1
67222255,"You mentioned dengue without mentioning the Almighty malaria, now we ll have more breeding sites for anopheles mosquitoes because of stagnant water in gutters, cans, tires and more bushes that harbour this vector ( A. arabienses, A. melas, A gambiea, A. funestus)",malaria,1
37824301,buh we prone to malaria ma nigga...,malaria,1
93229385,"Sounds somehow! complications of Tramadol and other opiods:.constipation -can lead to Haemorrhoids, hernia.Respiration Depression , can cause instant death . Hypertension -can cause heart failure, aneurysm, stroke Thank you.",stroke,1
3658895,The small ones like 2wattes and 3 wattes for bedroom etc .The bigger ones like 12 and 16 wattes for halls . These lights can keep you and your families away from malaria .,malaria,1
49769541,Zimbabwe ti take over. Kenya should go rest joor. Modified. The most painful thing is debit alert. Must you tell me I just withdrew #1000 from the remaining 4k in my account. Why bank go dey send pesin heart attack for nothing?,heart attack,2
69626014,Malaria have death with me let them start the sale immediately.,malaria,0
43824612,Stroke and other chronic heart/cardiovascular disease treatment and cure,stroke,1
95449918,I guess the number of persons having malaria is more than what’s there on statistics. What is worth doing is worth doing well,malaria,1
108308304,The leaders don't care cause malaria is not a communicable disease.Malaria kill Nigerians twice more than Covid but don't receive half of the attention our government gives to covid.,malaria,1
4948309,a mistake you said?that mistake can cause a heart attack my friend.,heart attack,1
3166396,"people like you don't seem to understand the phrase one nigeria isnt on the minds of most others the same way it is on yours.So getting worked up over mere words, will give you a heart attack. Not so for others.",heart attack,2
98258325,Nigeria from new world .Malaria have been senor to covid 19 .Every body is among malaria patient.,malaria,1
20307571,Mosquito net is the most effective way to prevent mosquito bite. The idea is NO BITE NO MALARIA. We customizes mosquito net for your bed. Give us call today or visit our web blog. mykingbiz com,malaria,1
35026053,She was 1st diagnosed of Flu 2ce? what is the proof that she died of Malaria.,malaria,0
77575257,"I went to the hospital today and was told i had malaria .In another news, Doctor prescribed Coartem but on getting to the pharmacist , she instead it wasnt safe since pregnancy isn't up to 3 months .Torn between the two professionals now , don't know whom to follow . mothers what do you think ?",malaria,0
88944737,"artemisia, is a common malaria drug. Is not possible.",malaria,1
5098123,"is it compulsory that wenever u get t the clinic that u are sick, they run a testand next thing is that u r tld u have malaria nd tyhoid.lets get the way out of this pls",malaria,1
40761789,jesus this news almost gave me a heart attack oh my God this is the worst yet ........,heart attack,2
4346761,WHERE ARE THE REHAB CENTRES?WHERE ARE THE FREE CLINICS?WHERE ARE THE AFFORDABLE SCHOOLS FOR THE POOR?It would be nice if you can provide us the addresses of these wonderful facilities set up by daddy G.O.There's no time to waste!Every 30 seconds a child dies of malaria!,malaria,1
6096718,Na wa O! dis pikin wan give im mama heart attack!,heart attack,2
78308619,Bruv nairaland is not the best place to seek counsel on issues like this. Peeps here will expedite your heart attack bro,heart attack,1
100285876,You no even dey shame. See the quality of weytin you dey smoke. Better no give yourself cancer for nothing. This kind weed fit give person stroke.,stroke,1
29761876,"<user> Heart disease is the number 1 Worldwide. In Developing countries like Nigeria. Malaria, HIV/AIDS, Diarrhea disease are most common and they are not worldwide leading causes of death. Thanks for your input.",malaria,1
54938444,Typhoid is a bacteria that is treated with antibiotics. So treated malaria and typhoid gives you a mixture of malaria and antibiotic medicines. This shows that it is safe. But considered so many things before you buy. Meet a pharmacist so that you do not end up get resistance.,malaria,1
77654186,No bro the fact is black people have natural anti bodies that combat malaria thats why you see random cases of malaria with very and rare cases resulting to death.,malaria,1
15128639,December 2012 for typhoid malaria.,malaria,1
38882891,"This Is hmmmm true coz I lost my Dad on a monday, died of heart attack.",heart attack,0
100265837,You're a good liar. So that is the pattern of movement for someone tripping on their clothe? That man behaves like someone almost having a heart attack and you called that tripping on clothe. Issokay... I pray God heals him. But don't lie shamelessly.,heart attack,1
78687551,Please only a doctor can prescribe malaria drugs for you at this stage. First trimester is a very delicate stage. Some drugs can cause harm to your baby,malaria,1
302879,great and that was a wonderful attack on John ! i hope the guy wont die from heart attack !Nice joke,heart attack,2
48752043,"have you been infected with HIV? What ur saying is akin to describing chills(which is just a part of the malaria complex) as worse than malaria . HPV is an AIDS defining illness. Why am I even wasting my time, I'm talking to a lay man",malaria,1
49593346,She's gonna prove to you too how hot guys are giving her signs. Let's see who will have the heart attack between you too.,heart attack,1
67460548,"Instead of this unending episode, you should have just write the name of the traditional malaria medicine.",malaria,1
90876313,"Are they as contagious as covid? Lord knows if its infection was similar to that of malaria and fever, the world would have calmed down by now",malaria,1
9484631,Rake said that? So was it malaria/typhiod?,malaria,1
38329016,The private hospital my husband picked for the insurance scheme said that they cover only malaria. So we are confused about the whole thing,malaria,1
94556082,"LOL <user> shouldn't have brought your ordeal here, son. Bringing your problems here is an elixir for heart attack.",heart attack,1
5397307,"Dr. Tom, this recommendation is it suitable for pregnant women that has malaria?",malaria,1
89475827,Another malaria patience you mean,malaria,1
6558839,"Anyway , you kept your age from us, but this cud be a warning sign of stroke . contact a physician before it is late.",stroke,0
99648781,"For two weeks now, I have been experiencing severe fatigue. I went to two hospitals and series of test were ran. I was diagnosed with malaria parasite, and placed on medication.Each night, I find it difficult to sleep because of the severity of the fatigue. During the day, the fatigue is minimal.",malaria,0
15335601,"Hello all, i ve not being updating, A̶̲̥̅♏ so sorry abt dat, i was down wit malaria but A̶̲̥̅♏ much beta nowUpdate Breakfast: nutrend, eggLunch: rice ǻn̶̲̥̅̊ԃ beans Veggie ǻn̶̲̥̅̊ԃ fruits : garden egg leaves, tigernut,mango",malaria,0
102782687,"Stop making excuses for promiscuous girls, which kind heart attack? You all sound like her pimpp.",heart attack,2
69094992,the problem is not God nor religion but you.... do you expect God to come hold your hand whenever you want to maturbate or He should give you stroke so your arms become useless against the act?Acquire knowledge and learn to discipline yourself. its like stealing and blaming God (or even the devil)...,stroke,2
52567283,"A lot of factors may be responsible. the best way to.be sure is trough a medical test at Med Lab. Not drinking enough water, malaria, typhoid, renal issues etc could be responsible. U need to visit hospital to be certain",malaria,1
70694874,Lol.Buhari go get heart attack die ooo First it was lifeless and now home of the poorest? Haba naa Make una take it easy oo,heart attack,2
28126354,"Abeg who get malaria tablet here Na the Japan game I say I win....look that tip well, no be combo. One Lost; the other Won.",malaria,1
49951549,"Please my grandmother has partial stroke, what herbs do you suggest?",stroke,0
52639569,<user> Wishing you safe delivery in Jesus name I also took the anti malaria Drugs last week and it was not even fansidar but I can tell you I haven't felt so sick since I got pregnant after I took it,malaria,0
175024,Just to add here that a sickle cell carrier will still suffer from Malaria but the effects will be mild because the parasites only infect the healthy red blood cells and not the sickled shaped cells,malaria,1
57867021,At the stroke of time. Wehdone Sir.,stroke,2
63795164,"These are not prescriptions for malaria or typhoid. Its for ulcer. We can't say for certain if the injections you received are for the malaria or typhoid. The test results would have also been helpful. If there is no improvement on your brother, you may want to consider seeking medical attention elsewhere.",malaria,1
63751213,Are you wandering what cerebral malaria is? Learn more about cerebral malaria now on NATURAL REMEDY LAB. It is deadlier than you think.,malaria,1
44922468,U can try using supplements like swissgarde products.their products helped my father in law with his stroke and we have heard countless testimonies about them.,stroke,0
108792921,Sure u have treated ur self from malaria and hepatitis,hepatitis,0
93805803,"Forgive her for your kids sake. But take her for HIV, hepatitis and std tests.",hepatitis,1
87781501,"What we have in Nigeria are audio coronavirus, someone with headache, malaria,fever, typhoid will be claiming Corona.Ladies and gentlemen,men and women, people of Nigeria coronavirus in Nigeria is a scam and has no place in the typical African man body system.",malaria,1
28153498,u r sick nd u will with heart attack cos Apc will win hands down,heart attack,2
2742987,"HAHAHAHA! MALARIA! Clem, give it to him",malaria,1
66618328,"Same thing almost happened to my brother in law..also a Barrister,guy was hypertensive and never bothered with his drugs for over 5 months,waiting on God for some miracle..got some minor stroke with inability to even articulate his name..",stroke,0
531048,"very true, u shud be more concerned about hepatitis. the virus live way longer than the HIV virus.",hepatitis,1
29939753,".. I agree wiv u 101%... A lot of people are guilty of this... They tell u they experienced dis signs b4 and when they took malaria drugs, they became ok... They are scared of visiting labs for test...",malaria,1
56254835,True for now. All that would change if he by some stroke of luck becomes president before 2019,stroke,2
106343918,"Start with your finger, then make it two, gradually she will get wide as you stroke the g spot. Then , you can now insert your dick.As time goes on, her vjay will get familiar and be able to accommodate your dick",stroke,2
77123104,Ewedu has been known to cure many diseases including HIV cancer tuberculosis elephantiasis and so onIts just that white ppl are jealous of YorubasLalasticlala,tuberculosis,1
73123517,1. Location - Nwaniba Area in Uyo.2. Primary Health Care centre to cater for usual regular ailments like malaria and all.3. We will hire a doctor who can double as an administrator.4. Medical cases that a primary health centre can handle.Are these answers good enough for you?4.,malaria,1
35565058,Thank God my grandma is around. Would tell her to prepare the concoction for me. I've noticed she hardly catches malaria although she fears falling ill from mosquito bites. Its possible her strong immune response is from the bitter leaf concoction.,malaria,1
61867772,iiaatmgirlI treated malaria in my first trimester and I'm doing fine.Doctor said it was better to treat it than leaving it unattended to.,malaria,0
38980320,"70% wealth sharing indeed, customized thunder and stroke is the best gift for such gold diggers. After all men have been succeeding without men's supposed help. Àwón omo alé jatijati.",stroke,2
15298740,see the way the thing is pulling his skin down...chai mosquitoes BAD OH...and i tot its only malaria dey good <user> our african mosquitoes cause this too...or is it a specific type?,malaria,1
7158444,"dont worry hes not a deadbeat like u ,we can hold a relationship , we fight quarell , fuccck d hell out of each oda still hin manlinesss still dey intact , i dont bite i stroke gently and carefull cus i insured dat shittt, so dont b jealous dumboooo",stroke,2
41871030,Ur fellow what? Come mr. Man' don't provoke me oh.... Wat have u been able to develop? Even the malaria drugs u sell u still make mistakes.Last time i check almost all the hospital in my area close up when they hear ebola.,malaria,1
103937235,"This story is too good to be true. They are rich, kids in Canada, they are young too. The man had a stroke and she had the chance to play this game. I don't buy it!",stroke,0
42496921,"Sounds like Nduka to me. When malaria dey fear we Nigerians e come be Nduka virus, him papa there",malaria,2
11268109,inevitable as AS have more resistance to malaria if my memory serves,malaria,1
90522303,"Scamdemic..... ¼ of the cases were forcefully diagnosed with Covid-19, ½ of the cases are Malaria and Typhoid cases, just few are covid-19 cases (asymptomatic patients) Only very few had the virus, and it's not as deadly as the world has painted it to be",malaria,1
34651201,drink aloe vera gel its great for malaria prevention am a testimony to it.,malaria,1
105564004,"The dude you're replying hit his head on a hard surface as a kid, been suffering from bouts of brain stroke ever since....all what you're saying isn't getting processed by him.",stroke,2
51165066,Exactly. I was only responding to that person who quoted you. This approach won't go anywhere in solving the current economic challenge. It's like taking panadol to cure malaria.,malaria,1
16383609,"Exactly, infact i attended a course some weeks back for officers where the use of Sulphadoxine-Pyrimethamine in treating malaria in pregnant women was reiterated. Nairaland should verify stories before posting and stop quoting Nigeria Newspapers with their JUNK journalism.",malaria,1
84721649,"Oga not everyone is like us, let's learn from good examples n bad ones.Orange Revolution of Ukraine was movements that lasted for 2 months n 1 day. with a large crowd yet only one person died n not killed by police but heart attack.Buhari didn't handle this well trust me",heart attack,0
79783579,I bet as at this moment many are already struck down with Thyphoid or Malaria... Especially in this rainy-Season!Your Solution is just a phone-call away.. Okay!..,malaria,1
6045286,"Im AA, A+. I get malaria wenever i expose myself 2 mosquitoes.",malaria,0
84295025,"Mama, if you are comfortable with the hospital, complete your dose. It's better to complete it. Malaria is dangerous to be left half treated.",malaria,1
28352492,I am AA the frequency of malaria is very much. Does anybody knows any prophylatic i can take to control the malaria,malaria,0
87365433,"This is very serious,but i have this feeling that malaria which is prevalent in Nigeria and Africa and which has the same symptoms as covid19 has already ""immunized"" us against covid19 hence the low infection rate in this parts.I may be wrong though.",malaria,1
97792515,No its not malaria drugs.,malaria,1
91088004,"Most people here recover without taking drugs. It's overhyped. Malaria and other sicknesses kill more, why haven't we locked down",malaria,1
87399616,I'm pretty sure there are Nigerians who have this virus walking freely...They may have the symptoms but they would be treating it as a Normal fever or malaria due to ignorance.....,malaria,1
48508880,maybe you should do an mp test first. I was having those Malaria like symptoms and Dr said twas part of d package. the mp test result came out negative too,malaria,0
73604997,I took him to the health center and Fbc and Malaria test was done for him. His Wbc is 9300 pcv 36%. Malaria parasite seen. We were given Amoksiklav and and broncholyte. Thank you ma.,malaria,0
60140081,"You tried bro..Despite the loss, it was a master stroke..Keep it up",stroke,2
84381363,"Kindly get consultation on what next to do from Consultant(s) on Geriatrics as I don't interfere with oldies especially on stroke cases... Some of the notable clinic centres are based in UI teaching hospital, UPTH, ULTH etc. Kindly explore any.",stroke,1
102212703,"So when you are sick of Malaria, what do you do?",malaria,1
46184062,Continue with your malaria dream!! It is easier for Leceister to win the next champions league than for an EFCC official to come 1000m close to GEJ,malaria,2
45288092,"In my recent research it was made know that overweight people or obese have high tendency to have asthma. It was also establish in a news from health pertitionals that diabetes, overweight and fat in the blood causes stroke, therefore all this need to be attend to in time. For more inform, contact me",stroke,1
104111028,"Baboons and monkeys from the ZOO called Nigeria running away from their kangaroo court.That's what happens when you are a failure.Zombies should Agitate that Nigeria government should sentence kanu to death fast,because Kanu will still be giving them heart attack from detention.",heart attack,1
92487878,"I just treated malaria last month and now, I have it again. I've bought a mosquito net now but is there anyway I can stop falling sick very often?? I've taken drugs too many times this year alone. Any natural remedies to prevent malaria and boost immunity? Thank you",malaria,0
8849436,"Knowledge is power.many aids patients have committed suicide which is uncall for.d truth is viral illnesses like ebola,lassa,hepatitis,and hiv are still mysterious to doctors.media proganda overates them.i ve got 3 materials on hiv and may be helpful.see d download links.",hepatitis,1
88786985,All i am saying is most of these people dont have the virus. Na malaria them get,malaria,1
77796969,"Educative write -up. Once suffered stress-induced burn-out which actually had illness symptoms, some of which was enumerated in the post. Not all malaria are really it. It may just be stress.",malaria,1
56784939,"Go check malaria,typhoid fever/Hiv status..Stress is one of the cause.drink blood tonic won't make u fat.Go see ur DR.Dnt wait for dem Rats melicine seller doc here with their mixture",malaria,1
105976061,"How about people slump and sir on the streets as it was reported earlier in China or on social media.If I have malaria right now, how am I sure I won't be branded Covid.",malaria,1
46277164,"Premium Times, Hmmmmh. No report on my ill health? even when I ve been down with malaria and cold. Thank God I am better now, PMB pls get well soon.",malaria,0
59505350,"Persistent hypertension is one of the risk factor for stroke, heart attack, heart failure and also chronic renal failure. Hypertension is usually symptomless but may cause headaches and visual disturbance.",stroke,1
61039900,"This was me 3 months ago. It was exhausting Sorry dear I know exactly how you feel. Perhaps you should take her back to the hospital When my son had sepsis/malaria/pneumonia, he was placed on admission for 4 days.",malaria,0
